table,column,name_long,units,description_md
bird_mammal_transect,datetime_start_utc,Datetime UTC,,"Survey date-time, built from date + time_sec (local tz unconfirmed; see questions)."
bird_mammal_transect,cruise_key,Cruise Key,,"CalCOFI cruise natural key, best-effort from cruise_label + date (no ship column; see questions)."
bird_mammal_transect,grid_key,Grid Key,,CalCOFI grid-cell key from spatial join of the midpoint.
bird_mammal_transect,geom,Geometry,,Midpoint geometry in WGS84 (EPSG:4326).
bird_mammal_observation,observation_id,Observation ID,,Sequential primary key (one row per transect/species/behavior).
